,tweet_id,text,is_sarcasm
711,786078144545562624,bomb this image keeps getting deleted from social media by admins thinking face i wonder why do you know,True
712,786301065088135168,i wanted the billboard to be squeezing two handfuls of hotdogs but this will do tix,True
713,786770125269663744,maybe it's not the illegal immigrants that are keeping you from landing a job just saying,True
714,787896994404503557,i hope you get fired cheating is the only way she'll win hey is this okay with you,True
715,788562193998614528,check out our new tool every time tweets something offensive automatically donate,True
716,788743064009388032,anyone with children knows that whining about imaginary cheating is the last refuge of the sore loser,True
717,788743764428730368,it's not rigged you're losing fair square put on your big-boy pants because this is what accountability looks like,True
718,788840733465718784,whether it's washington brussels or london we've seen emergence of an out of touch political class,True
719,788921162591973376,will do more in the first days in office than hillary has done in the last years debate,True
720,789121633378299904,last night i watched display everything i expect out of the potus donald displayed everything i expect out of a th grader,True
721,789593187287339009,these are your us inteligence agencies how's the coast guard investigation going or dea or,True
722,790032274611920896,hey i'm sta ing to put together my halloween costume,True
723,791588157347205124,unlike warmonger hillary won't sta wwii  jill stien a vote for hillary is a vote for ww,True
724,791731500765052932,are you still against the tpp seems your own campaign manager can't recall your publicposition o,True
725,792073315854626816,i speak the best hindi ,True
726,792130832408408064,someone please help me locate this woman as mr trump has a gift for her,True
727,792802828230074368,so i should stop re tweeting about charity too bullying love i should just shut my female mouth shouldn't i jus,True
728,792857931519660032,lgbtq+ lives are at stake in this election the trump pence ticket suppo s electrocuting the queerness out of kids,True
729,792886007465115648,has been answering am phone calls his entire life ask chris stevens if hillary answered at am,True
730,793060332570808320,hey happy halloween here's a thought why don't you dress up as an orange-haired pussy cat and grab yourself meow jack-o-lantern jack-o-lantern,True
731,793472940880699392,wants to make america great while crooked hill want to make america wait watch like and re-twe,True
732,793487179917824000,very interesting not following on twitter anymore wonder why that is hmm thinking face thinking face fbimwithher podestaemails,True
733,793590123048890368,got a text message from noting that trump is ahead in a big poll and asking me to chip in ask soros for,True
734,793885033723494400,someone explain why emails are still a headline when the kk just endorsed trump a judge just set a date for his rape trial,True
735,793898384298012672,republican friends even these guys are voting for,True
736,793902707295649793,good point is the candidate who might end global warming by bringing us nuclear winter don't be,True
737,793907927899701249,current issue of newsweek explains illegally deleted troves of subpoenaed emails double standard,True
738,793942821103235072,do you mind helping me out a little,True
739,695429511228182528,i don't believe in free college ,True
740,705451341477498880,michiganders lost their jobs due to nafta i opposed that bad deal did not,True
741,707753267082764288,i am you know adamantly against illegal immigration ,True
742,762374379514765314,i'm dead serious i reviewed a number of videos and i think has early onset parkinson's disease it appears she takes l-dopa,True
743,780155023955267593,any democrat that votes for her is a mindless idiot her words not mine black voters should be incensed give,True
744,784916104569380870,americans are dead after being abandoned by and locker room talk offends you more,True
745,787474762998034432,what do we have here looks like uncovered footage of denouncing david duke in he's a bigot,True
746,788154460635889664,hey have you seen my bombshell on dnc inciting violence at rallies,True
747,788537028233273344,so my great grandmother who passed away in just got registered to vote in california hmm wonder who did that,True
748,789567429554954240,anything happens to me there's a deadman's switch on pa ii which will be released monday and implicated,True
749,791364506425315328,i know where hillary clintons deleted emails are and how to get them legally,True
750,792117296781066240,a very prophetic tweet by about anthony weiner over year ago retweet lockherup donate now,True
751,793271906551996416,silly its your campaign manager that has ties to russian banks go sober up you are embarrassin,True
752,794258979878797317,hidden cam foreign national campaign worker calls himself expe @ making illegal donations to t,True
753,794597352673837058,hey satanist rituals like spiritcooking really is this why you wanted to remove god from dem platform,True
754,794735739598761984,breaking is leading in polls in impo ant battleground states qatar iraq iran saudi arabia rememberwhentrump was never,True
755,794950980693528577,podestaemails did you ever have doubts whether was pro and blocking other candidates,True
756,795302764511432704,directed her maid to print out classified materials some of them about libya and iran,True
757,795303063397355520,[watch] president obama commit treason in why is this man not in prison,True
758,795305301318791169,maybe she doesn't do windows directed her maid to print out classified materials via,True
759,795355352720179200,revelations that asked her maid to print out classified material at her home gives the word reckless a whole new meaning,True
760,795371058652213253,fbi's last minute week investigation of is either most efficient thing us gov has ever done or total bs comey,True
761,795372877897940992,hillary finally has a record to run on she wasn't indicted epicfail mideastchaos fraud vote,True
762,795430833133715456,is being protected by a rigged system,True
763,795470114359427072,dncleak wow dnc discussing their faked groping charges against dnc is scum,True
764,795671363214340096,chaffetz if is clean why does her staff keep pleading the fifth election,True
765,795699667287818240,or the tl dr version i've called charities looking for proof gives millions to charity her,True
766,795830821659770880,mayor giuliani the [clinton] maid who had access to top-secret material it's a crime hannity foxnews,True
767,795982963909357568,breaking  endorses for president,True
768,796009375324405760,welcome to hillary's america where women are attacked for wearing a trump jersey she paid for them to do it too,True
769,796010320569450496,breaking historic moment when fbi suspect casts vote for an fbi suspect electionday,True
770,796012972443320321,police car light breaking bernie sanders endorses trump electionday voted,True
771,796028811708088320,breaking historic moment when fbi suspect casts vote for an fbi suspect electionday,True
772,796046574359035905,unfo unately melania copied her ballot from michelle so donald just voted for hillary electionday,True
773,796047173012127744,when a presidential candidate can't even trust his own wife to vote for him neve rump electionday,True
774,796051049597390849,that moment when you're pretty sure not even your wife would want to vote for you electionday,True
775,796057094738890752,if donald trump wins i'll paypal everyone that retweeted this electionday,True
776,796063894934605824,police car light breaking repo s of voterfraud in philly instructional ballot being handed out inside polling stations double exclamation mark,True
777,796097946857209856,if donald trump wins this election i will literally give people who retweet this tweet electionday,True
778,796107064317804544,hillary is on her way to an airpo to watch the election results parked on a runway with flight plans to qatar electionday,True
