,tweet_id,text,is_sarcasm
0,264033382076407808,you are full of shit,False
1,265895586660757505,you're fucking retarded,False
2,265895723445411841,you are the stupidest man on planet ea h,False
3,265896172726661120,i am continually amazed and terribly inspired by you if such an idiot can make a ton of money here's hope for me yet,True
4,266042962650226688,hey you mad bro,True
5,291941831476920321,go fuck yourself,False
6,299530972087599105,if you hate america so much you should run for president and fix things,False
7,331907859916922880,you asshole stfu abt military you know nothing men like you assault think it's a woman's fault as a vet you sicken me,False
8,365694278845997057,dude that's freaking cool as heck wind turbine blades will slice million birds and bats to death in yrs,True
9,377947866641485824,i would like to extend my best wishes to all even the haters and losers on this special date september th,True
10,388618880605646848,beautiful morning walk in hyde park london with,False
11,427956124411641856,retweet if you agree w hillaryclinton,False
12,440331541580099584,why the fuck do i even follow you because you're addicted to genius asshole,True
13,440688053129318400,if was president middle class would make more i honestly think he could keep jobs in america so true-easy,True
14,484662433404162048,haha just came up and asked are you guys the vamps we are all confused and impressed she was soo nice,False
15,516382428395745280,do you pay an angry year old boy to handle your twitter account,True
16,537158751116357632,sadly your racism is poisoning your barely functioning brain you are a terrible person,False
17,587354526857957376,hillary clinton has stolen our innovative wikileaks twitter logo design compare vs,False
18,587364252484296705,yaas,False
19,592958704196059136,it's clear been racist saying our african american president it's plain to see we won't miss u when u perish,False
20,596194588064354304,there's an impo ant choice to be made today vote wisely  favourite for milk first  retweet for milk last electionday,False
21,624651124545581056,has been a great friend for many years we don't need another politician we need a businessman like mr trump trump,False
22,625869142592212992,toast dems had better get the'b team off the bench for attorney general under president trump,False
23,630010650488541184,not sure why blasts for objectifying woman treating women as objects really megyn,True
24,634155794724814848,i mean if you're so good at negotiating how come you couldn't get,True
25,634750634420531200,every time i see address a crowd i want to sta chanting usa usa usa americanpride is back trump,False
26,634892204759056384,if only keeps of his promises that will still be times more than the has in years,True
27,638663725763923968,a real hero would have actually written fuckface coward,False
28,643583883506749441,fuck,False
29,651489489811046401,which clown would you rather see as president retweet for bozo the clown favorite for donald trump,True
30,658662473231298560,hey you saw a kid lost in new york and didn't tell an adult how can we trust you to be president,False
31,661259584418545664,thank you for tweeting me so honored to suppo you,False
32,665937465430188032,why should americans trust you to be president when they can't even trust you to sell the stunner,False
33,667407931768512512,hey i'm an american muslim and i already carry a special id badge where's yours semperfi usmc,True
34,669296173241540609,he's got game in it to win it makeamericagreatagain,False
35,670180327399165952,my superpac the american people go trump we got your back makeamericagreatagain trump,False
36,671463022280347648,how can u deny climate change when my pussy this hot fire sun fire,False
37,671881255655489536,i don't hear much from these days has she been arrested if not why not ccot tcot pjnet p,True
38,673988818198892544,every candidate for president needs to do the right thing condemn statement,False
39,674008204838199297,finally trashed by will still reserve him a seat on the blue origin rocket senddonaldtospace,True
40,674375959626256384,cc  red ale trump team  lunatic progressives calling for trump assassination,False
41,674423766491922432,why i am a trump suppo er trump,False
42,675390247165915137,you are a disgrace not only to the gop but to all america withdraw from the u s presidential race as you will never win,False
43,676958069423808513,give me a small christmas gift of a million dollars,True
44,677194957443088384,in an age of pussified political correctness you have to respect the people who remain unfiltered,True
45,678992241357000705,over of middle east refugees in usa collect welfare oa news refugee,False
46,681156670186192898,,False
47,681773089173024768,front page trump wins in landslide new york times  november trump,False
48,681975261064110080,hang in there america it won't be long vote for trump the next potus trump trumptrain a,False
49,687317650658189312,to bernie sanders with thanks for your commitment to real health care access for all americans ,False
50,688744010010107904,no you don't fuck you,False
51,690330740458967041,oga trump edakun when you win plss help me depo jide in texas me he stole my gf rm me in secondary school,True
52,690562515500032000,poor jeb i could've sworn i saw him outside trump tower the other day,True
53,691087262776426497,we are the united states of america we're coming united to take our country back trump,False
54,692033042383269888,my po rait of made using only the racist sexist ignorant and bigoted things he has said,False
55,692504112882171904,anne frank's stepsister compares to hitler in holocaust remembrance essay,False
56,692552032113270784,,False
57,692790423010566144,trump you base your statements on photoshopped pics i bailed you out twice a rd time maybe,False
58,692915677099868160,i decided as a student a hispanic and an american to suppo leader a father and a unifier,False
59,693175853853904898,oh yeah btw i still have a copy of this tweet you deleted sir,False
60,700374837517090817,shi by history by madeforhistory imwithher,False
61,700569519253618689,being in vegas for pieceofme is amazing for so many reasons especially when you get to meet,False
62,701146981142376449,meet me in person and tell me my brother yusor razan were deserving of the bullets scprimary ou hreewinners,True
63,703260852753981440,politicians let us down now its payback time trump trump makeamericagreatagain,False
64,703532623772180480,care to explain neve rump,False
65,703752690464063488,to get in the plane and go home,False
66,703900742961270784,it is better to live one day as a lion than years as a sheep makeamericagreatagain,True
67,704756959019474948,bless your hea,True
68,705344003399495680,we are praying for you trumpnation trumptrain no weapon formed against you will prosper,False
69,705912175492071425,it's still fuck you,False
70,706122813933879296,the fact didn't attack the way he attacked tells you everything,False
71,706942758284599298,btw i'm a democrat crossing over to for life trumptrain trump,False
72,707757793458130945,we have laws  demdebate,False
73,708123394563284993,tell us more about how sexism is wrong gopdebate,True
74,710106794970972160,thank you so much president to god be the glory for you the holy spirit is with you trumptrain,False
75,712380720656883713,retweet if donald j trump has your vote for the general election retweet for a revolution,False
76,714880276833386496,european people want to become potus to stop the radicalism islamic invasion wiprimary trump,False
77,715617770541416448,the good deeds of that msm won't tell you maga votetrump stopthesteal,False
78,716290187467227136,its all very suspect neverhillary womenfo rump trump,False
79,718269634814865410,first wwe hall of famer to become president,True
80,718576790076329984,hello boys this is my formal endorsement of i'm a woman last i checked and rudy u r amazing,True
81,719358634686341121,the gop tried to shut reagan down too look what happened trump makeamericagreatagain united states,False
82,719474959286800385,wins wy but nets more delegates it is a system rigged against voters,False
83,720658373914583041,one of my followers tweeted this meme yesterday i think it sums up quite nicely,False
84,722628702748688385,wow really nice,False
85,723227294781857792,ayo i almost forgot to tell you,True
86,724273120144678913,why are sg john hatley lt clint lorance in prison while obama frees gitmo terrorists,True
87,724408451963621377,from pue o rico with love middle finger light skin tone middle finger medium-light skin tone middle finger medium skin tone middle finger medium-dark skin tone middle finger dark skin tone,True
88,725683449370165248,trump on board the train double exclamation mark locomotive dashing away dashing away dashing away dashing away dashing away dc united states,False
89,727767817253203969,let's get this pa y sta ed madame secretary trump,True
90,727844765795024896,on the same day becomes our nominee we celebrate the life of my pup brookie i wont forget u baby,False
91,728273809925496832,rock on believing in from the begining  when so many thought trump was a joke,False
92,728317229943554049,any day is a great day for pho soup i love asians,True
93,729857410446336000,united states i am a woman i just voted for nebraskaprimary trump trumpforpresident,False
94,731258790159499264,dad daughter work day when the option to spend time w grandpa showed she dropped me like a rock face with tears of joy,False
95,732760762536464386,,False
96,732977711358955521,i am a black woman educated ba mba independent thinker i suppo trump person raising hand medium skin tone trump maga dealwithit,False
97,733858324089700352,smiling face with hea eyes sweat droplets daddy,False
98,735915713404260352,i am delighted that has agreed to debate let s do it in the biggest stadium possible,False
99,739120672446676992,it's not racist to say america first it's nationalist i've always been for my country first that's why i'm for ca nm,False
100,740326782029549568,proud to suppo she's making history not for herself but for women everywhere imwithher,False
101,740349876333076481,you're good at one thing lying,False
102,740973713965907968,can we trust you watch hillaryforprison,True
103,740974036541313024,just like all those emails requested by congress,True
104,740975081921216512,one thing is for sure this is the weirdest fucking election cycle of all time,False
105,740975156001148928,,False
106,740993607289688065,if anyone knows how to use a delete key it's you,True
107,741116436215701504,i believe the term is just rat delete,True
108,741202449139007488,wow my newborn just said mum isn't prioritising symbolic victories over material gains antithetical to leftism,True
109,741413352132509696,trump crosses all barriers in prayer dr parson trump buildthewall trump,False
110,741764117934055424,,False
111,741811105291489280,we are all family join trump family we the people family,False
112,743219394155683840,stop pandering you're so fake it's ridiculous trump neverhillary dropouthillary,False
113,743992032901795841,stay out of houston this for my people trump,False
114,746259655639318528,it's a great thing that the people of the uk have taken back their country says after brexit,True
115,747919445431967744,hillary i'll lie steal cheat or kill benghazi neverhillary imwithher maga,True
116,749003458926305280,clint eastwood on trump he is fearless he is great likeaboss trump trumptrain,False
117,750455702108286976,is representing the absolute hea break anger frustration in a government gone bad,False
118,751497493871890434,notice the differences dallaspoliceshootings makeamericagreatagain,False
119,752113909348216832,greatest campaign picture ever just love it,False
120,752529684303343620,for those who don't fully grasp how badly messed up,False
121,752960915444633601,show this to those who don't fully grasp the severity of email breach because the media won't,False
122,753690111632674820,references pok mongo,False
123,753923452919087105,i predicted a presidency on nov one yr later on nov it'll be reality maga,False
124,753965091544969216,you are our only hope mr trump imwithyou,False
125,754070414851276800,those are profound statements coming from our soldiers risking their lives for us trumppence j la red hea,False
126,756040651779760130,teamtrumppa will swing pa from crookedhillary blue to red americafirst trumppence locomotive dashing away united states united states,False
127,756324079301496832,me with some of the dangerous terrorists doesn't want to risk giving refuge to syrianrefugees,True
128,756331289037402112,i m with you not included women african americans lgbt people muslims latinos immigrants,True
129,756507277264297985,dear thank u for promising to protect me from terrorists while glossing over the fact that you'd take away my marriage,True
130,756648692283834368,sorry no one was paying attention to your announcement we are all too busy ready wikileaks dncleak,True
131,756654167800807424,is brilliant and progressive and he will make a great vp alongside imwithher and i'm excited to be with them,False
132,756710850694639617,thank you for the terrific endorsement of by who will b our next potus,False
133,757792685205786624,had an amazing time tonight suppo ing at the demsinphilly tonight imwithher,False
134,758134742415925248,watch me + friends suppo ing stronge ogether demsinphilly,False
135,758363610145927168,will be the st woman to be a major pa y presidential nom see the big moment on cnn demsinphilly,False
136,758424621867757569,since this is veep nite at dnc i thought it would b appropriate declare proudly imwithher,False
137,758482393850343424,if you're with and all the way to the white house,False
138,758856435283275778,,False
139,759117371239915520,hillary clinton exposed,False
140,759531057859395584,wow thinks we muslim women aren't allowed to speak let's let him hear us in nov in honor of mrs khan raised fist medium-light skin tone trumpsacrifices,True
141,759605904614518785,what a great day so proud of and let's go win this together,False
142,759923959206850571,we're coming watch out,False
143,760162462473871362,huma abedin could be chief of staff dems did you know about this backhand index pointing down crookedhillary crookedstaff,True
144,760169625321701376,even if you don't have children or grandchildren you will be asked for the rest of your life what did you do to stop,False
145,760498161806827520,mr charles woods says hillary lied about how his son tyrone woods died in benghazi neverhillary,False
146,760991811317932032,if trump builds the pipeline buffet will lose billion now you know why he's with her,True
147,761297948495994882,my pledge locomotive dashing away no matter what they say trump says does is or was he has my loyalty white heavy check mark ote united states trumppence united states imwithyou,False
148,762820080409333760,how many times can we retweet this video of falling while getting on to air force one trump,True
149,763028427498807297,this is the punk who says trumps not fit to run for president j la red hea,True
150,763153156268109824,it must be the responsibility of all americans to condemn remarks the violence they suggest,False
151,763425766956797952,collision go granny collision trumppence neverhillary americafirst nra alwaystrump trumptrain maga,False
152,765116420569071616,imwithyou friend let's bury the past failures trumppencelandslide americafirst trumppence,False
153,765261359722274816,great speech thus far this is why you're getting my vote,False
154,765676213671120896,a trump inspired dance tune for the election,False
155,766461872765677568,wakeupamerica maga a ccot tcot,False
156,766825906459377664,whereshillary watching this video of sho circuiting,True
157,767052608653692928,presently in hispanic roundtable with leaders from across the country,False
158,767942167830507520,with a message for the amazing people in akron ohio all aboard the trumptrain let's maga united states united states,False
159,768590515667345410,years old hispanic a woman this is why i suppo ps = the inspiration for this face blowing a kiss,False
160,768613669781417984,thank you for the tremendous introduction decent people can beat the establishment,True
161,769277794815737858,alex jones uncovers pickle-gate picklegate,False
162,770239868664442880,ever wonder why republicans want voter id obama won in every state that did not require a photo id,True
163,770412361081458688,en route to oklahoma to campain for we're stronger together united states imwithher,False
164,770423536129302528,personally looks at hits comment counts on stories was i censored your call,True
165,771161424806764545,dear god we pray in the name of jesus christ that you bless help him to be elected potus in,False
166,771484413834047488,tomorrow on on the death of his cousin and response,False
167,771897464093806592,who wants a president that could be blackmailed dr ben carson,True
168,772155907677556736,september months after vince foster's death clinton campaign security jerry parks murdered,False
169,772193860336357376,doesn't fit the msm narrative  so they wont share what did for jesse jackson in  so i will,False
170,772203008126058497,huge youtuber dna reveals he is th cousin,False
171,772578181584941056,you make me look like an angel,True
172,772792238489292800,a presidency would threaten religious libe y and put our constitutional rights in danger,True
173,772820984818696192,mrs bill clinton's worst nightmare black outreach he can connect with anyone,True
174,772910861870518272,the suppo for is unbelievable massive crowds everywhere trumpincanfield maga united states united states,False
175,773278843243270144,thank you for reading i'm incredibly moved to be accurate i'm ugly crying imwithher,True
176,773336278574039040,thank you annawintour for inviting me to this incredible event in suppo of,False
177,774176507576987648,is not racist there's really not excuses for people calling him that latinoswithtrump maga united states,False
178,774534287173554176,dear hi it's me one of the deplorables just wanted to let you know we won't fit in a basket ,True
179,774656602507018245,revolving hea s love all my deplorable basketbuddies for trump basketofdeplorables maga united states trumppence united states,True
180,774686275517440000,black people know when they're speaking to a racist pa ii basketofdeplorables maga boycottnfl,False
181,774732447648845825,my deplorable wife and deplorable me out knocking and handing out yard signs basketofdeplorables,True
182,775380862653247488,people who want their borders secured are not racists they're patriotic americans,False
183,775825843721469953,ivanka penned an op-ed that ran in the this afternoon read it here,False
184,775855934828453888,thanksobama for showing us the lies of politicians just like you will say anything to get elected,True
185,777279274101436416,family time after a long week on the campaign trail for definitely needed this maga trump,False
186,777518198837153792,um why are we paying for hillary's campaign trump proves to be right again riggedsystem,True
187,777659481081671681,just remember is fighting for you and hillary is fighting for her biggest donors maga trump,False
188,777856914961076224,tonight on the show and music from plus ew returns with fallontonight,False
189,777884879358988288,stopped by little haiti fl last week they weren't too happy w the clintons maga,False
190,777936284425781248,love and thank you always an honor my friend,False
191,778036749775675392,ladies and gentlemen,False
192,778403793969016832,my highest duty as president is to protect our citizens and to uphold the constitution of the united states ,False
193,778957045357772800,sits down between two ferns with zach galifianakis for her most memorable interview yet,False
194,779334733813587970,represents the political elite and so much of what has gone wrong over the past few decades,True
195,779461896625803264,viable candidates potus black circle hc=rd obama term red circle dt=real change in america trump maga folded hands medium skin tone united states,False
196,779488732621615105,i will lift my voice all over the nation get u elected thank u standing up against the establ,False
197,779495898690777088,new video is a failed businessman trumpbusinessfail trumptaxes,False
198,779507437392900096,the clinton misery a matter of temperament maga points neverhillary pointshigher,False
199,780223697860911104,some people seemed upset that i called a moron so i wanted to clarify my remarks he's also an asshole imwithher,True
200,780480921401118720,here's a list of of the biggest lies has told so far,False
201,780512370561060864,donald trump has no blood on his hands as does remember benghazi remember,False
202,780576068185063424,a administration will bring jobs back debates,False
203,780577527165284352,when speaks investments is a code word for crony capitalism government picking winners and losers debates,True
204,780578178729402370,government doesn't create jobs the private sector creates jobs debates,False
205,780579923295600640,has been pa of the rigged dc system for years why would we take policy advice from her debates,True
206,780581933176778752,this is the simple fact about she is a typical politician  all talk no action debates,False
207,780584959526498304,when is potus families are going to be safe and secure law and order will be restored maga,False
208,780588296065908737,i literally just did a dance around the room in my pj's exclamation mark microphone right arrow curving down,False
209,780588962398298112,i agree with  don't vote for debates,False
210,780589091138236417,i agree with  don't vote for debates,False
211,780591395052584960,hillary's policies have made america less safe that's why + general and military leaders have endorsed,False
212,780594205009772545,shoulder shimmy debatenight,False
213,780596946247553024,i agree that you should have tremendous stamina debates,False
214,780597166041628672,microphone right arrow curving down microphone right arrow curving down microphone right arrow curving down,False
215,780600714636759040,proud of had a vision and a plan and did her thing she was on point well done,False
216,780604340318773248,i received my passpo i'm ready to vote for my country for you for my daughter for women workers,False
217,780616850497384449,i'm flabbergasted that actually has a platform to speak to this many people i'm appalled,False
218,780737152107810816,voters are a bit like brexit voters they have enthusiasm passion trump has momentum and i t,True
219,780906000391864320,couldn't be more proud of her vision and command during last night's debate showed that she's ready to be our next,False
220,780948368205946880,for the record i competed in treated me w nothing but the upmost suppo respect both during after my reign,False
221,781093767713591297,is the continuity candidate if you want change in america you vote for,False
222,781508799932862465,crowds vs crowds by the numbers,False
223,781579899836465153,unbelievable is considering for the supreme cou this is why americans think the,False
224,781926108140703745,donald trump spelt backwards is pmu dlanod which makes no sense just like his thoughts,True
225,781945287925456901,problem isn't that he couldn't be heard on monday night his problem is we all heard him quite clearly,True
226,781967242317684737,make sure bullying never reaches the white house chip in now,False
227,782040839795113985,next on hannity while the clinton campaign tries to paint as sexist we speak with three women who say he's anything but,False
228,782640515850211329,carrie prejean was one of the only people that stood up for me and defended me,False
229,783007622588837888,hey here's my weak dad who volunteered to take your place in vietnam he died early rip dad he,True
230,783152079036620800,this guy got there at am and got a hug from he was so excited proud and he definitely de,False
231,783367117819088896,if the don't have the backbone to stand up to they don't have the backbone to stand up for working families,False
232,783416436001759233,our job is to elect and to understand that on the day after we are not finished we must continue the movement,False
233,783474744133840896,has a pay-to-play problem just like crooked vpdebates bigleaguetruth,False
234,783479285042581504,bold forward-looking economic plan will increase jobs wages incomes and oppo unities for all americans vpdebate,False
235,783479870131240960,law enforcement officers bring communities together keep us safe respect stand,False
236,783487018764558337,we need strong broad-shouldered leadership like in the white house vpdebate,False
237,783489855124860928,think you're deplorables basementdwellers think yo,False
238,783492506319069184,careless use of a secret server put national security at risk vpdebate bigleaguetruth,False
239,783850992332709888,uncle donald is a hero already so lets vote donald j trump for us president ,False
240,783870253008769024,this is so pathetic if weren't so vile i would almost feel sorry for her but she is and i don't,False
241,784138581812011008,getting down to brass tacks united states united states united states united states united states wethepeople gop wakeupamerica maga trumptrain trump,False
242,784162682270285828,cannot lead people you loathe,True
243,784224142694363136,my grandma estelle l schultz age born yrs before women could vote with her absentee ballot for st female p,False
244,784405076320382977,update i've now called charities looking for proof that gave millions of his own to charity,True
245,784497335124525059,anyone who is for women cannot vote for hillary,True
246,784594283009609728,were you lying or was sexual assault pa of your action every day it s a simple question you should have to answer it,True
247,784609346714013698,,False
