,index,text,is_sarcasm
268,268,fuuck noo like hell fucking noo hell the fuckingg the noo hell the fucking fuu,False
269,269,check out our new tool every time tweets something offensive automatically donate,True
270,270,first wwe hall of famer to become president,True
271,271,oga trump edakun when you win plss help me depo jide in texas me he stole my gf rm me in secondary school,True
272,272,anything happens to me there's a deadman's switch on pa ii which will be released monday and implicated,True
273,273,i am continually amazed and terribly inspired by you if such an idiot can make a ton of money here's hope for me yet,True
274,274,it s hard not to see this as anything other than a down payment to influence fbi s criminal investigation into,False
275,275,mrs bill clinton's worst nightmare black outreach he can connect with anyone,True
276,276,over of middle east refugees in usa collect welfare oa news refugee,False
277,277,police car light breaking bernie sanders endorses trump electionday voted,True
278,278,presently in hispanic roundtable with leaders from across the country,False
279,279,in an age of pussified political correctness you have to respect the people who remain unfiltered,True
280,280,you make me look like an angel,True
281,281,sadly your racism is poisoning your barely functioning brain you are a terrible person,False
282,282,hey have you seen my bombshell on dnc inciting violence at rallies,True
283,283,hang in there america it won't be long vote for trump the next potus trump trumptrain a,False
284,284,i don't hear much from these days has she been arrested if not why not ccot tcot pjnet p,True
285,285,are you still against the tpp seems your own campaign manager can't recall your publicposition o,True
286,286,new wikileaks a king's m for access to |,False
287,287,hey happy halloween here's a thought why don't you dress up as an orange-haired pussy cat and grab yourself meow jack-o-lantern jack-o-lantern,True
288,288,cyrus for clinton since the beginning red hea blue hea red hea blue hea red hea blue hea make ur plans now to vote on nov,False
289,289,instead of facing consequences for her actions like others have been protected at every turn by the obama admin,False
290,290,which clown would you rather see as president retweet for bozo the clown favorite for donald trump,True
291,291,police car light voterfraud philly democrat judge of elections inside voting booth with voter double exclamation mark electionday ivoted via,False
292,292,problem isn't that he couldn't be heard on monday night his problem is we all heard him quite clearly,True
293,293,if only keeps of his promises that will still be times more than the has in years,True
294,294,why are sg john hatley lt clint lorance in prison while obama frees gitmo terrorists,True
295,295,my friend revokes his endorsement of,False
296,296,let's get this pa y sta ed madame secretary trump,True
297,297,just like a casual fyi person tipping hand light skin tone,False
298,298,hey here's my weak dad who volunteered to take your place in vietnam he died early rip dad he,True
299,299,i don't hear much from these days has she been arrested if not why not ccot tcot pjnet p,True
300,300,michiganders lost their jobs due to nafta i opposed that bad deal did not,True
301,301,it's great to be in nh with  tough sma women who fight for us,False
302,302,aye mobile phone with arrow text roar to to score free admission tickets to see me this saturday in philly i'll be the one singing microphone lovetrumpshate red hea,False
303,303,represents the political elite and so much of what has gone wrong over the past few decades,True
304,304,sorry no one was paying attention to your announcement we are all too busy ready wikileaks dncleak,True
305,305,dear hi it's me one of the deplorables just wanted to let you know we won't fit in a basket ,True
306,306,represents the political elite and so much of what has gone wrong over the past few decades,True
307,307,lgbtq+ lives are at stake in this election the trump pence ticket suppo s electrocuting the queerness out of kids,True
308,308,finally trashed by will still reserve him a seat on the blue origin rocket senddonaldtospace,True
309,309,i'm dead serious i reviewed a number of videos and i think has early onset parkinson's disease it appears she takes l-dopa,True
310,310,i would like to extend my best wishes to all even the haters and losers on this special date september th,True
311,311,dear hi it's me one of the deplorables just wanted to let you know we won't fit in a basket ,True
312,312,midnight rally in michigan at m views growing watch,False
313,313,breaking historic moment when fbi suspect casts vote for an fbi suspect electionday,True
314,314,ever wonder why republicans want voter id obama won in every state that did not require a photo id,True
315,315,which clown would you rather see as president retweet for bozo the clown favorite for donald trump,True
316,316,imwithyou friend let's bury the past failures trumppencelandslide americafirst trumppence,False
317,317,or the tl dr version i've called charities looking for proof gives millions to charity her,True
318,318,silly its your campaign manager that has ties to russian banks go sober up you are embarrassin,True
319,319,hey you mad bro,True
320,320,we are all family join trump family we the people family,False
321,321,make sure bullying never reaches the white house chip in now,False
322,322,tell us more about how sexism is wrong gopdebate,True
323,323,just like all those emails requested by congress,True
324,324,pledges to end conversion therapy lgbt kids don't need to be cured of anything,False
325,325,you're an authoritarian life-long liberal who disrespects life libe y equality we can't trust you on justices,False
326,326,mrs bill clinton's worst nightmare black outreach he can connect with anyone,True
327,327,she's caught paying people to riot at trump rallies her whole inner circle does satanic spiritcooking and last n,False
328,328,unfo unately melania copied her ballot from michelle so donald just voted for hillary electionday,True
329,329,greatest campaign picture ever just love it,False
330,330,we are the united states of america we're coming united to take our country back trump,False
331,331,collision go granny collision trumppence neverhillary americafirst nra alwaystrump trumptrain maga,False
332,332,breaking news the fbi is re-opening their investigation into secret server,False
333,333,wow my newborn just said mum isn't prioritising symbolic victories over material gains antithetical to leftism,True
334,334,when is potus families are going to be safe and secure law and order will be restored maga,False
335,335,lgbtq+ lives are at stake in this election the trump pence ticket suppo s electrocuting the queerness out of kids,True
336,336,someone explain why emails are still a headline when the kk just endorsed trump a judge just set a date for his rape trial,True
337,337,dude that's freaking cool as heck wind turbine blades will slice million birds and bats to death in yrs,True
338,338,i hope you get fired cheating is the only way she'll win hey is this okay with you,True
339,339,how can u deny climate change when my pussy this hot fire sun fire,False
340,340,yuge pt shift toward trump in just days,False
341,341,sorry no one was paying attention to your announcement we are all too busy ready wikileaks dncleak,True
342,342,what's worse americans abandoned in benghazi or locker room talk,False
343,343,construction trump has his eye on the ball and the folks to buildthatwall trumppence imwithyou,False
344,344,are you still against the tpp seems your own campaign manager can't recall your publicposition o,True
345,345,wikileaks bill clinton says white working class hopeless  this includes many of my friends vote,False
346,346,breaking video pennsylvania voters repo voting machines flipping votes from trump to clinton electionday,False
347,347,not sure why blasts for objectifying woman treating women as objects really megyn,True
348,348,if donald trump wins this election i will literally give people who retweet this tweet electionday,True
349,349,police reform gun control mental health awareness women's rights affordable education debates,False
350,350,my name is brittany and i just witnessed voter fraud at pa polling place [video] myvote electionday,False
351,351,help with no h carolina hurricane victims mr trump gave his o,False
352,352,flashback seems to have changed her story about the use of a private email server,False
353,353,it must be the responsibility of all americans to condemn remarks the violence they suggest,False
354,354,thanksobama for showing us the lies of politicians just like you will say anything to get elected,True
355,355,breaking is leading in polls in impo ant battleground states qatar iraq iran saudi arabia rememberwhentrump was never,True
356,356,thank you for reading i'm incredibly moved to be accurate i'm ugly crying imwithher,True
357,357,[watch] president obama commit treason in why is this man not in prison,True
358,358,directed her maid to print out classified materials some of them about libya and iran,True
359,359,why is my son in prison for mishandling classified information while who's done much worse is ru,False
360,360,my pledge locomotive dashing away no matter what they say trump says does is or was he has my loyalty white heavy check mark ote united states trumppence united states imwithyou,False
361,361,if trump builds the pipeline buffet will lose billion now you know why he's with her,True
362,362,just like all those emails requested by congress,True
363,363,maybe she doesn't do windows directed her maid to print out classified materials via,True
364,364,last night i watched display everything i expect out of the potus donald displayed everything i expect out of a th grader,True
365,365,someone please help me locate this woman as mr trump has a gift for her,True
366,366,watch with pride as this builds to the powerful climax dedicated to trump suppo ers maga,False
367,367,the democrats are abandoning the rapidly sinking crooked hillary ship goofy elizabeth warren has unfollowed,False
368,368,wants a safe america w stronger borders no amnesty and an end to sanctuary cities he is,False
369,369,um why are we paying for hillary's campaign trump proves to be right again riggedsystem,True
370,370,i predicted a presidency on nov one yr later on nov it'll be reality maga,False
371,371,hillary i'll lie steal cheat or kill benghazi neverhillary imwithher maga,True
372,372,that moment when you're pretty sure not even your wife would want to vote for you electionday,True
373,373,huma abedin could be chief of staff dems did you know about this backhand index pointing down crookedhillary crookedstaff,True
374,374,not sure why blasts for objectifying woman treating women as objects really megyn,True
375,375,new video is a failed businessman trumpbusinessfail trumptaxes,False
376,376,police car light breaking machine refuses to allow vote for trump in pennsylvania the hell out of it voterfraud voted,False
377,377,just like michelle says when they go low we go high went high and showed why she'll be a potus for all americans,False
378,378,high crimes = high time here's to a great sta gogogowdy lockherup wikileaks trumppence,False
379,379,trumptrain locomotive dashing away united states came out in force to suppo the gop nominee next potus a movement like never se,False
380,380,references pok mongo,False
381,381,ivanka penned an op-ed that ran in the this afternoon read it here,False
382,382,a administration will bring jobs back debates,False
383,383,son of the late ronald reagan is finally coming around and he says he s going to suppo,False
384,384,were you lying or was sexual assault pa of your action every day it s a simple question you should have to answer it,True
385,385,the suppo for is incredible  our movement is making history maga trumptrain,False
386,386,just like all those emails requested by congress,True
387,387,directed her maid to print out classified materials some of them about libya and iran,True
388,388,you make me look like an angel,True
389,389,dear thank u for promising to protect me from terrorists while glossing over the fact that you'd take away my marriage,True
390,390,when investigating donald trump goes horribly wrong face with tears of joy tuesdaymotivation youre so bad face with tears of joy you were de,True
391,391,horrifying that moms have to work days after giving bi h st step to fix elect uwomen,False
392,392,i don't hear much from these days has she been arrested if not why not ccot tcot pjnet p,True
393,393, its called extreme vetting debates,True
394,394,maybe she doesn't do windows directed her maid to print out classified materials via,True
395,395,couldn't be more proud of her vision and command during last night's debate showed that she's ready to be our next,False
396,396, its called extreme vetting debates,True
397,397,who wanted to crucify gennifer flowers who called lewinsky a narcissistic loony toon answer,True
398,398,lgbtq+ lives are at stake in this election the trump pence ticket suppo s electrocuting the queerness out of kids,True
399,399, its called extreme vetting debates,True
400,400,americans are dead after being abandoned by and locker room talk offends you more,True
401,401,my name is brittany foreman and today i witnessed voterfraud spread it deplorables don't let them steal ou,False
402,402,when investigating donald trump goes horribly wrong face with tears of joy tuesdaymotivation youre so bad face with tears of joy you were de,True
403,403,breaking historic moment when fbi suspect casts vote for an fbi suspect electionday,True
404,404,homeless trump suppo er guards star on hollywood blvd against all sjws basedsentinel magax,False
405,405,hillary finally has a record to run on she wasn't indicted epicfail mideastchaos fraud vote,True
406,406,crowd beats protestor notice how they're using signs to block view of cameras,False
407,407, its called extreme vetting debates,True
408,408,think you're deplorables basementdwellers think yo,True
409,409,veteran dem pollster pat caddell on hrc  dam is about break  landslide for h t,False
410,410,do you mind helping me out a little,True
411,411,stop pandering you're so fake it's ridiculous trump neverhillary dropouthillary,False
412,412,michiganders lost their jobs due to nafta i opposed that bad deal did not,True
413,413,our job is to elect and to understand that on the day after we are not finished we must continue the movement,False
414,414,i wanted the billboard to be squeezing two handfuls of hotdogs but this will do tix,True
415,415,video machine refuses to allow vote for trump in pennsylvania  electionday,False
416,416,i'm dead serious i reviewed a number of videos and i think has early onset parkinson's disease it appears she takes l-dopa,True
417,417,y'all seen this stay woke guys out here rigging machines,False
418,418,update i've now called charities looking for proof that gave millions of his own to charity,True
419,419,hey satanist rituals like spiritcooking really is this why you wanted to remove god from dem platform,True
420,420,has a pay-to-play problem just like crooked vpdebates bigleaguetruth,False
421,421,hey happy halloween here's a thought why don't you dress up as an orange-haired pussy cat and grab yourself meow jack-o-lantern jack-o-lantern,True
422,422,dude that's freaking cool as heck wind turbine blades will slice million birds and bats to death in yrs,True
423,423,you got this debates,False
424,424,mayor giuliani the [clinton] maid who had access to top-secret material it's a crime hannity foxnews,True
425,425,with fbi re-opening criminal investigation democrats on the ballot must now be asked whether or not they still suppo,False
426,426,do you mind helping me out a little,True
427,427,i am you know adamantly against illegal immigration ,True
428,428,these are your us inteligence agencies how's the coast guard investigation going or dea or,True
429,429,i earlier in motorcade en route to flight to st louis for debate photo credit,False
430,430,which clown would you rather see as president retweet for bozo the clown favorite for donald trump,True
431,431,voter fraud caught on tape in philadelphia  electionday,False
432,432,police car light urgent trump voters do not listen to exit poll data the media is lying suppress trump vote go to vote no matte,False
433,433,treason gets less coverage than the locker-room talk no wonder america thinks your a joke,False
434,434,obama's response to mean tweet on was perfect more coming soon,False
435,435,florida poll leads to specialrepo,False
436,436,donald trump spelt backwards is pmu dlanod which makes no sense just like his thoughts,True
437,437,represents the political elite and so much of what has gone wrong over the past few decades,True
438,438,man you got yelled at by tic tacs this is not going well,True
439,439,got a text message from noting that trump is ahead in a big poll and asking me to chip in ask soros for,True
440,440,say whatever you want about all he wants is to maga for all americans,False
441,441,clarification from dem operatives pneumonia expect emergency dnc meeting to consider replacement hillaryshealth,False
442,442,sorry no one was paying attention to your announcement we are all too busy ready wikileaks dncleak,True
443,443,anything happens to me there's a deadman's switch on pa ii which will be released monday and implicated,True
444,444,voters are a bit like brexit voters they have enthusiasm passion trump has momentum and i t,True
445,445,americans are dead after being abandoned by and locker room talk offends you more,True
446,446,breaking voters in pa repo ballots defaulting to clinton  electionday,False
447,447,mayor giuliani the [clinton] maid who had access to top-secret material it's a crime hannity foxnews,True
448,448,has been pa of the rigged dc system for years why would we take policy advice from her debates,True
449,449,police car light breaking bernie sanders endorses trump electionday voted,True
450,450,hillary finally has a record to run on she wasn't indicted epicfail mideastchaos fraud vote,True
451,451,hey you mad bro,True
452,452,mayor giuliani the [clinton] maid who had access to top-secret material it's a crime hannity foxnews,True
453,453,ayo i almost forgot to tell you,True
454,454,cannot lead people you loathe,True
455,455,keep them notes memo,True
456,456,years old hispanic a woman this is why i suppo ps = the inspiration for this face blowing a kiss,False
457,457,state depa ment leaked information to about her investigation podestaemails lockherup,False
458,458,my superpac the american people go trump we got your back makeamericagreatagain trump,False
459,459,breaking jay z punches underage girl in the face for taking his picture backstage at rally,False
460,460,huge youtuber dna reveals he is th cousin,False
461,461,problem isn't that he couldn't be heard on monday night his problem is we all heard him quite clearly,True
462,462,i'm dead serious i reviewed a number of videos and i think has early onset parkinson's disease it appears she takes l-dopa,True
463,463,breaking  endorses for president,True
464,464,my deplorable wife and deplorable me out knocking and handing out yard signs basketofdeplorables,True
465,465,revelations that asked her maid to print out classified material at her home gives the word reckless a whole new meaning,True
466,466,wow thinks we muslim women aren't allowed to speak let's let him hear us in nov in honor of mrs khan raised fist medium-light skin tone trumpsacrifices,True
467,467,,False
468,468,dncleak ties podesta to child kidnapping  then rare dos attacks shut wikileaks down probably twitter too,False
469,469,this is so pathetic if weren't so vile i would almost feel sorry for her but she is and i don't,False
470,470,hey happy halloween here's a thought why don't you dress up as an orange-haired pussy cat and grab yourself meow jack-o-lantern jack-o-lantern,True
471,471,more emails show illegal coordination between and super pac podestaemails,False
472,472,why are sg john hatley lt clint lorance in prison while obama frees gitmo terrorists,True
473,473,very sma for to now almost solely focus on what he will do for america turning the page from clinton corruption,False
474,474,aide cheryl mills didn't want her to run because of private server podestaemails,False
475,475,when investigating donald trump goes horribly wrong face with tears of joy tuesdaymotivation youre so bad face with tears of joy you were de,True
476,476,this is the simple fact about she is a typical politician  all talk no action debates,False
477,477,on top of talking bout erica garner problem chair implied her dad's death might not be police ag,False
478,478,i'm dead serious i reviewed a number of videos and i think has early onset parkinson's disease it appears she takes l-dopa,True
479,479,supersisters and campaign for in ga and fl brilliant and beautiful,False
480,480,keep them notes memo,True
481,481,why are sg john hatley lt clint lorance in prison while obama frees gitmo terrorists,True
482,482,i'm flabbergasted that actually has a platform to speak to this many people i'm appalled,False
483,483,hey you mad bro,True
484,484,anything happens to me there's a deadman's switch on pa ii which will be released monday and implicated,True
485,485,hillary finally has a record to run on she wasn't indicted epicfail mideastchaos fraud vote,True
486,486,bless your hea,True
487,487,an illegal under arrest by ice agents for attempting to vote in dade county fl be vigilant electionday,False
488,488,it's a great thing that the people of the uk have taken back their country says after brexit,True
489,489,this is the a of biljana djurdjevic a favorite of tony podesta brother of campaign manager,False
490,490,michiganders lost their jobs due to nafta i opposed that bad deal did not,True
491,491,personally looks at hits comment counts on stories was i censored your call,True
492,492,i am delighted that has agreed to debate let s do it in the biggest stadium possible,False
493,493,hello boys this is my formal endorsement of i'm a woman last i checked and rudy u r amazing,True
494,494,my deplorable wife and deplorable me out knocking and handing out yard signs basketofdeplorables,True
495,495,breaking fed more questions to camp ahead of march town hall podestaemails,False
496,496,this development raises serious s about what records may not have been turned over why whether they show inte,False
497,497,exclusive story young soldier tells how stepped in to help at critical time,False
498,498,front page trump wins in landslide new york times  november trump,False
499,499,why should americans trust you to be president when they can't even trust you to sell the stunner,False
500,500,hillary i'll lie steal cheat or kill benghazi neverhillary imwithher maga,True
501,501,here's a list of of the biggest lies has told so far,False
502,502,watch me + friends suppo ing stronge ogether demsinphilly,False
503,503,a real hero would have actually written fuckface coward,False
504,504,hello boys this is my formal endorsement of i'm a woman last i checked and rudy u r amazing,True
505,505,this guy got there at am and got a hug from he was so excited proud and he definitely de,False
506,506,someone explain why emails are still a headline when the kk just endorsed trump a judge just set a date for his rape trial,True
507,507,which clown would you rather see as president retweet for bozo the clown favorite for donald trump,True
508,508,overconfidence has sta ed hurling trash bags full of her clothes over the white house fence,False
509,509,i have a question for the republicans,False
510,510,yes you ve never heard of me because while you were harassing women at beauty pageants i was fi,False
511,511,someone explain why emails are still a headline when the kk just endorsed trump a judge just set a date for his rape trial,True
512,512,hooray cast my ballot for today so proud to suppo him nov trumptrain will deliver him,False
513,513,a window into her soul watch for shocking details on how got off a child rapist,False
514,514,i don't believe in free college ,True
515,515,,False
516,516,meet me in person and tell me my brother yusor razan were deserving of the bullets scprimary ou hreewinners,True
517,517,join live in wisconsin with gov coach bobby knight live,False
518,518,let's get this pa y sta ed madame secretary trump,True
519,519,i m with you not included women african americans lgbt people muslims latinos immigrants,True
520,520,current issue of newsweek explains illegally deleted troves of subpoenaed emails double standard,True
521,521,dem voter fraud caught red-handed maga trumppence trumptrain trump,False
522,522,got a text message from noting that trump is ahead in a big poll and asking me to chip in ask soros for,True
523,523,care to explain neve rump,False
524,524,hillary finally has a record to run on she wasn't indicted epicfail mideastchaos fraud vote,True
525,525,haha just came up and asked are you guys the vamps we are all confused and impressed she was soo nice,False
526,526,whereshillary watching this video of sho circuiting,True
527,527,cc  red ale trump team  lunatic progressives calling for trump assassination,False
528,528,good point is the candidate who might end global warming by bringing us nuclear winter don't be,True
529,529,at years old nothing will stop these ladies from casting their votes for in virginia united states,False
530,530,just remember is fighting for you and hillary is fighting for her biggest donors maga trump,False
531,531,sorry no one was paying attention to your announcement we are all too busy ready wikileaks dncleak,True
532,532,i received my passpo i'm ready to vote for my country for you for my daughter for women workers,False
