,index,text,is_sarcasm
533,533,wants to make america great while crooked hill want to make america wait watch like and re-twe,True
534,534,poor jeb i could've sworn i saw him outside trump tower the other day,True
535,535,you should give the money back draintheswamp,False
536,536,mrs bill clinton's worst nightmare black outreach he can connect with anyone,True
537,537,um why are we paying for hillary's campaign trump proves to be right again riggedsystem,True
538,538,or the tl dr version i've called charities looking for proof gives millions to charity her,True
539,539,police car light media police car light won't show black trump supp never aired him blackout kellyfile,False
540,540,let's get this pa y sta ed madame secretary trump,True
541,541,you know what [ not running to be pope,True
542,542,any day is a great day for pho soup i love asians,True
543,543,i voted for today here in israel today via absenteeballot maga trumptrain trumppence,False
544,544,let's see million jobs added dow up abt bin laden dead climate change action aca sounds good to me,False
545,545,in an age of pussified political correctness you have to respect the people who remain unfiltered,True
546,546,this is the punk who says trumps not fit to run for president j la red hea,True
547,547,a presidency would threaten religious libe y and put our constitutional rights in danger,True
548,548,you need both a public and a private position debates,False
549,549,donald trump has no blood on his hands as does remember benghazi remember,False
550,550,alex jones uncovers pickle-gate picklegate,False
551,551,fbi's last minute week investigation of is either most efficient thing us gov has ever done or total bs comey,True
552,552,hey happy halloween here's a thought why don't you dress up as an orange-haired pussy cat and grab yourself meow jack-o-lantern jack-o-lantern,True
553,553,breaking will return to arizona on wednesday rsvp here,False
554,554,were you lying or was sexual assault pa of your action every day it s a simple question you should have to answer it,True
555,555,of gop in fl is crossing over for and i want to hug the man holding this sign god bless americ,False
556,556,these are your us inteligence agencies how's the coast guard investigation going or dea or,True
557,557,hey i'm an american muslim and i already carry a special id badge where's yours semperfi usmc,True
558,558,,False
559,559,watch this lawyer tell staffers to break the law btw ms guypana disappeared when vid was released,False
560,560,that clintons raked in millions while same donors had biz before state dept points to clear pay-to-play culture,False
561,561,you're fucking retarded,False
562,562,current issue of newsweek explains illegally deleted troves of subpoenaed emails double standard,True
563,563,ayo i almost forgot to tell you,True
564,564,dnc planned the false sexual harassment charges against dncleak,False
565,565,hello boys this is my formal endorsement of i'm a woman last i checked and rudy u r amazing,True
566,566,has been pa of the rigged dc system for years why would we take policy advice from her debates,True
567,567,he's got game in it to win it makeamericagreatagain,False
568,568,will do more in the first days in office than hillary has done in the last years debate,True
569,569,hillary clinton secretly received debate question in advance from cnn,False
570,570,what did mean by this,False
571,571,if you like the past years vote,False
572,572,we will never forget benghazi and the blood on hillary's hands maga trumppence,False
573,573,rock on believing in from the begining  when so many thought trump was a joke,False
574,574,if you're already preparing a seat at the table for raising hands medium-light skin tone,False
575,575,on very first day of campaign we caught campaign directors breaking the law foreigndonations tcot,False
576,576,tonight gave a textbook display of her dishonesty and evasiveness debates,False
577,577,dncleak wow dnc discussing their faked groping charges against dnc is scum,True
578,578,getting down to brass tacks united states united states united states united states united states wethepeople gop wakeupamerica maga trumptrain trump,False
579,579,if was president middle class would make more i honestly think he could keep jobs in america so true-easy,True
580,580,must talk about the issues tonight america's place in the world strong border controls and help,False
581,581,reds electionday giveaway vote for a prize then this poll and follow us to be entered to win the prize getting the most votes,False
582,582,unlike warmonger hillary won't sta wwii  jill stien a vote for hillary is a vote for ww,True
583,583,if is president she ll be all talk and nothing will get done debate bigleaguetruth,False
584,584,tomorrow on on the death of his cousin and response,False
585,585,lgbtq+ lives are at stake in this election the trump pence ticket suppo s electrocuting the queerness out of kids,True
586,586,revolving hea s love all my deplorable basketbuddies for trump basketofdeplorables maga united states trumppence united states,True
587,587,give me a small christmas gift of a million dollars,True
588,588,voters are a bit like brexit voters they have enthusiasm passion trump has momentum and i t,True
589,589,so that's what they think of us black community leaders in nc respond to top donor saying blacks,False
590,590,hillary is on her way to an airpo to watch the election results parked on a runway with flight plans to qatar electionday,True
591,591,bernie sanders attorney who was suing dnc over stealing election found dead on bathroom floor #,False
592,592,i speak the best hindi ,True
593,593,my grandma estelle l schultz age born yrs before women could vote with her absentee ballot for st female p,False
594,594,chaffetz if is clean why does her staff keep pleading the fifth election,True
595,595,someone explain why emails are still a headline when the kk just endorsed trump a judge just set a date for his rape trial,True
596,596,dncleak wow dnc discussing their faked groping charges against dnc is scum,True
597,597,if donald trump wins i'll paypal everyone that retweeted this electionday,True
598,598,stopped by little haiti fl last week they weren't too happy w the clintons maga,False
599,599,man you got yelled at by tic tacs this is not going well,True
600,600,whereshillary watching this video of sho circuiting,True
601,601,i m not running to be president of the world i m running to be president of the united states ,False
602,602,last night i watched display everything i expect out of the potus donald displayed everything i expect out of a th grader,True
603,603,what do we have here looks like uncovered footage of denouncing david duke in he's a bigot,True
604,604,i decided as a student a hispanic and an american to suppo leader a father and a unifier,False
605,605,of florida early voting republicans have voted for,False
606,606,dncleak wow dnc discussing their faked groping charges against dnc is scum,False
607,607,you know what [ not running to be pope,True
608,608,you asshole stfu abt military you know nothing men like you assault think it's a woman's fault as a vet you sicken me,True
609,609,please retweet if not one word you heard say on the access hollywood bus surprised you not one word,False
610,610,has been a great friend for many years we don't need another politician we need a businessman like mr trump trump,False
611,611,it s fascinating voter fraud only seems to plague places where lots of people might vote for,False
612,612,very interesting not following on twitter anymore wonder why that is hmm thinking face thinking face fbimwithher podestaemails,True
613,613,thank you for the tremendous introduction decent people can beat the establishment,True
614,614,dominated this evening's debate don't think ever really got going,False
615,615,ladies and gentlemen,False
616,616,i will not defend or endorse but i am voting for him hrc is that bad hrc is bad for the usa,False
617,617,you asshole stfu abt military you know nothing men like you assault think it's a woman's fault as a vet you sicken me,True
618,618,hey not to blame hidden emails smashed devices folks plead th is what put us here truth,False
619,619,republican friends even these guys are voting for,True
620,620,when trump went low went high we're prouder than ever to be with her shewon,False
621,621,current issue of newsweek explains illegally deleted troves of subpoenaed emails double standard,True
622,622,check out our new tool every time tweets something offensive automatically donate,True
623,623,welcome to hillary's america where women are attacked for wearing a trump jersey she paid for them to do it too,True
624,624,sorry no one was paying attention to your announcement we are all too busy ready wikileaks dncleak,True
625,625,someone explain why emails are still a headline when the kk just endorsed trump a judge just set a date for his rape trial,True
626,626,i mean if you're so good at negotiating how come you couldn't get,True
627,627,it's not racist to say america first it's nationalist i've always been for my country first that's why i'm for ca nm,False
628,628,voting for i'm almost years old this is the first vote i've done nothing was ever impo,False
629,629,from pue o rico with love middle finger light skin tone middle finger medium-light skin tone middle finger medium skin tone middle finger medium-dark skin tone middle finger dark skin tone,True
630,630,on i hope he will be very much involved in my administration,False
631,631,that timeline microphone right arrow curving down fire,False
632,632,microphone right arrow curving down microphone right arrow curving down microphone right arrow curving down,False
633,633,rnc should sue over the brazile leaked questions viewers who watched should sue as they were duped,False
634,634,show this to those who don't fully grasp the severity of email breach because the media won't,False
635,635,police car light breaking police car light machine refuses to allow vote for trump in pennsylvania voterfraud electionday,False
636,636,there's an impo ant choice to be made today vote wisely  favourite for milk first  retweet for milk last electionday,False
637,637,wow thinks we muslim women aren't allowed to speak let's let him hear us in nov in honor of mrs khan raised fist medium-light skin tone trumpsacrifices,True
638,638,btw i'm a democrat crossing over to for life trumptrain trump,False
639,639,if anyone knows how to use a delete key it's you,True
640,640,is raising your taxes to a disastrous level is going to lower your taxes  big l,False
641,641,from pue o rico with love middle finger light skin tone middle finger medium-light skin tone middle finger medium skin tone middle finger medium-dark skin tone middle finger dark skin tone,True
642,642,latinos storming precinct sw miami to vote for our one and only president trump,False
643,643,can we trust you watch hillaryforprison,True
